jokeId,jokeText
1,"A man visits the doctor. The doctor says ""I have bad news for you.You have
cancer and Alzheimer's disease"". 
The man replies ""Well,thank God I don't have cancer!""
"
2,"This couple had an excellent relationship going until one day he came home
from work to find his girlfriend packing. He asked her why she was leaving him
and she told him that she had heard awful things about him. 

""What could they possibly have said to make you move out?"" 

""They told me that you were a pedophile."" 

He replied, ""That's an awfully big word for a ten year old."" 
"
3,"Q. What's 200 feet long and has 4 teeth? 

A. The front row at a Willie Nelson Concert.
"
4,"Q. What's the difference between a man and a toilet? 

A. A toilet doesn't follow you around after you use it.
"
5,"Q.	What's O. J. Simpson's Internet address? 
A.	Slash, slash, backslash, slash, slash, escape.
"
6,"Bill & Hillary are on a trip back to Arkansas. They're almost out of gas, so Bill pulls into a service station on the outskirts of
town. The attendant runs out of the station to serve them when Hillary realizes it's an old boyfriend from high school. She and
the attendant chat as he gases up their car and cleans the windows. Then they all say good-bye. 

As Bill pulls the car onto the road, he turns to Hillary and says, 'Now aren't you glad you married me and not him ? You could've
been the wife of a grease monkey !' 

To which Hillary replied, 'No, Bill. If I would have married him, you'd be pumping gas and he would be the President !' 
"
7,"How many feminists does it take to screw in a light bulb?
That's not funny.
"
8,"Q. Did you hear about the dyslexic devil worshiper? 

A. He sold his soul to Santa.
"
9,"A country guy goes into a city bar that has a dress code, and the maitre
d' 
demands he wear a tie. Discouraged, the guy goes to his car to sulk when 
inspiration strikes: He's got jumper cables in the trunk! So he wraps
them around his neck, sort of like a string tie (a bulky string tie to be
sure) and returns to the bar. The maitre d' is reluctant, but says to the
guy, ""Okay, you're a pretty resourceful fellow, you can come in... but
just don't start anything""!  
"
10,"Two cannibals are eating a clown, one turns to other and says: 
""Does this taste funny to you? 
"
11,"Q. What do a hurricane, a tornado, and a redneck
divorce all have in common? 
A. Someone's going to lose their trailer...
"
12,"A guy stood over his tee shot for what seemed an eternity, looking up, looking down, measuring the distance,
figuring the wind direction and speed. Driving his partner nuts.

Finally his exasperated partner says, ""What the hell is taking so long? Hit the goddamn ball!""
The guy answers, ""My wife is up there watching me from the clubhouse. I want to make this a perfect shot.""
""Well, hell, man, you don't stand a snowball's chance in hell of hitting her from here!"" 
"
13,"They asked the Japanese visitor if they have elections in his
country.  
""Every Morning"" he answers.
"
14,"The father was very anxious to marry off his only daughter so he wanted 
to impress her date. ""Do  you like to screw,"" he says. ""Huh"" replied the 
surprised first date. ""My daughter she loves to screw and she's good at it, 
you and her  should go screw,"" carefully explained the father. Now very 
interested the boy replied, ""Yes, sir."" Minutes later the girl came down 
the stairs, kissed her father goodbye and the couple left. After only a 
few minutes she reappeared, furious, dress torn, hair a mess and screamed
""Dammit, Daddy, it's the TWIST, get it straight!"" 
"
15,"Q:  What did the blind person say when given some matzah?

A:  Who the hell wrote this?
"
16,"Q. What is orange and sounds like a parrot?  

A. A carrot.
"
17,"How many men does it take to screw in a light bulb? 

One...men will screw anything. 
"
18,"A dog walks into Western Union and asks the clerk to send a telegram. He fills out a form on which he
writes down the telegram he wishes to send: ""Bow wow wow, Bow wow wow.""

The clerk says, ""You can add another 'Bow wow' for the same price.""

The dog responded, ""Now wouldn't that sound a little silly?"" 
"
19,"Q: If a person who speaks three languages is called ""tri-lingual,"" and
a person who speaks two languages is called ""bi-lingual,"" what do call
a person who only speaks one language?

A: American! 
"
20,"What's the difference between a MacIntosh and an
Etch-A-Sketch? 

You don't have to shake the Mac to clear the screen. 
"
21,"What's the difference between a used tire and 365 used condoms?

One's a Goodyear, the other's a great year.
"
22,"A duck walks into a pharmacy and asks for a condom. The pharmacist says
""Would you like me to stick that on your bill?""
The duck says: 
""What kind of duck do you think I am!""
"
23,"Q: What is the Australian word for a boomerang that won't
   come back? 

A: A stick
"
24,"What do you get when you run over a parakeet with a lawnmower? 
Shredded tweet.
"
25,"Two kindergarten girls were talking outside: one said, ""You
won't believe what I saw on the patio yesterday--a condom!""

The second girl asked, ""What's a patio?""
"
26,"A guy walks into a bar and sits down next to an extremely gorgeous 
woman.  The first thing he notices about her though, are her pants.  
They were skin-tight, high-waisted and had no obvious mechanism 
(zipper, buttons or velcro) for opening them.

After several minutes of puzzling over how she got the pants up over 
her hips, he finally worked up the nerve to ask her.  ""Excuse me miss, 
but how do you get into your pants?""

""Well,"" she replied, ""you can start by buying me a drink.""
"
27,"Clinton returns from a vacation in Arkansas and walks down  the
steps of Air Force One with two pigs under his arms.  At the bottom
of the steps, he says  to the honor guardsman, ""These are genuine
Arkansas Razor-Back Hogs.  I got this one for Chelsea and this one for
Hillary.""  

The guardsman replies, ""Nice trade, Sir.""
"
28,"A mechanical, electrical and a software engineer from Microsoft were
driving through the desert when the car broke down. The mechanical
engineer said ""It seems to be a problem with the fuel injection system,
why don't we pop the hood and I'll take a look at it."" To which the
electrical engineer replied, ""No I think it's just a loose ground wire,
I'll get out and take a look."" Then, the Microsoft engineer jumps in.
""No, no, no. If we just close up all the windows, get out, wait a few
minutes, get back in, and then reopen the windows everything will work
fine.""
"
29,"An old Scotsmen is sitting with a younger Scottish gentleman and says the boy. 
""Ah, lad look out that window. You see that stone wall there, I built it with
me own bare hands, placed every stone meself.  But do they call me MacGregor the
wall builder? No! 

He Takes a few sips of his beer then says, ""Aye, and look out on that lake and 
eye that beautiful pier. I built it meself, laid every board and hammered each
nail but do they call me MacGregor the pier builder? No! 

He continues...""And lad, you see that road? That too I build with me own bare 
hands. Laid every inch of pavement meself, but do they call MacGregor the road
builder? No!""

Again he returns to his beer for a few sips, then says, 
""Agh, but you screw one sheep...""
"
30,"Q: What's the difference between a Lawyer and a Plumber? 
A: A Plumber works to unclog the system.
"
31," President Clinton looks up from his desk in the Oval Office to see
 one of his aides nervously approach him. 
 ""What is it?"" exclaims the President. 
""It's this Abortion Bill Mr. President, what do you want to do
 about it?"" the aide replies. 
""Just go ahead and pay it."" responds the President. 
"
32,"A man arrives at the gates of heaven. St. Peter asks, ""Religion?"" 
The man says, ""Methodist."" St. Peter looks down his list, and says, 
""Go to room 24, but be very quiet as you pass room 8."" 

Another man arrives at the gates of heaven. ""Religion?""
""Baptist."" ""Go to room 18, but be very quiet as you pass room 8."" 

A third man arrives at the gates. ""Religion?"" ""Jewish.""
""Go to room 11, but be very quiet as you pass room 8."" 
The man says, ""I can understand there being different rooms for different religions, but why
must I be quiet when I pass room 8?"" St. Peter tells him, ""Well the Catholics are in room 8, 
and they think they're the only ones here.
"
33,"What do you call an American in the finals of the world cup?

""Hey Beer Man!""
"
34,"Out in the backwoods of some midwestern state, little Johnny arrives
at school an hour late.

Teacher: ""Why are you so late, John?""
Johny : ""My big brother got shot in the ass.""
(the teacher corrects his speech)
Teacher: ""Rectum.""
Johnny : ""Wrecked him!? Hell, It damn near killed him!"" 
"
35,"An explorer in the deepest Amazon suddenly finds himself surrounded
by a bloodthirsty group of natives. Upon surveying the situation, he
says quietly to himself, ""Oh God, I'm screwed."" 

The sky darkens and a voice booms out, ""No, you are NOT
screwed. Pick up that stone at your feet and bash in the head of the
chief standing in front of you."" 

So with the stone he bashes the life out of the chief. Standing above
the lifeless body, breathing heavily looking at 100 angry natives... 

The voice booms out again, ""Okay ..... NOW you're screwed."" 
"
36,"A guy walks into a bar, orders a beer and says to the bartender,
""Hey, I got this great Polish Joke..."" 

The barkeep glares at him and says in a warning tone of voice:
""Before you go telling that joke you better know that I'm Polish, both
bouncers are Polish and so are most of my customers""

""Okay"" says the customer,""I'll tell it very slowly."" 
"
37,"A Jewish young man was seeing a psychiatrist for an eating and
sleeping disorder. 

""I am so obsessed with my mother... As soon as I go to sleep, I start
dreaming, and everyone in my dream turns into my mother. I wake up in
such a state, all I can do is go downstairs and eat a piece of toast.""

The psychiatrist replies:

""What, just one piece of toast, for a big boy like you?""
"
38,"""May I take your order?"" the waiter asked. 

""Yes, how do you prepare your chickens?"" 

""Nothing special sir,"" he replied. ""We just tell them straight out
that they're going to die.""
"
39,"What is the difference between men and women:


A woman wants one man to satisfy her every need.
A man wants every woman to satisfy his one need.
"
40,"How many Irishmen does it take to change a lightbulb?

Two, one to hold the lightbulb and the other to drink until the room spins. 
"
41,"What does an atheist say during an orgasm?
""Oh Darwin! Oh Darwin!...""
"
42,"Two men are discussing the age old question: who enjoys sex more, the
man or the woman?  A woman walks by and listens in for awhile and then
interrupts: 
""Listen you guys. You know when your ear itches and you put in your 
little finger and wiggle it around for awhile?  Afterward,
which feels better, your finger or your ear?""
"
43,"Arnold Swartzeneger and Sylvester Stallone are making a movie about
the lives of the great composers.  
Stallone says ""I want to be Mozart."" 
Swartzeneger says: ""In that case...  I'll be Bach.""
"
44,"A horse walks into a bar. Bartender says:
""So, why the long face?""
"
45,"A boy comes home from school and tells his mother that he got a part
in the school play.  ""What part?"" the mother asked. ""I play a Jewish
husband,"" the boy replied.  
""Go back to school and tell your teacher that you want a speaking role!""
"
46,"A couple has been married for 75 years. For the husband's 95th
birthday, his wife decides to surprise him by hiring a prostitute.
That day, the doorbell rings. The husband uses his walker to get to
the door and opens it. 
A 21-year-old in a latex outfit smiles and
says, ""Hi, I here to give you super sex!"" 
The old man says, ""I'll take the soup.""
"
47,"There was an engineer who had an exceptional gift for fixing all 
things mechanical.  After serving his company loyally for over 30 
years, he happily retired.  Several years later the company contacted 
him regarding a seemingly impossible problem they were having with 
one of their multi-million dollar machines. They had tried everything and 
everyone else to get the machine fixed, but to no avail.  In 
desperation, they called on the retired engineer who had solved so 
many of their problems in the past.
The engineer reluctantly took the challenge.  He spent a day studying 
the huge machine.  At the end of the day, he marked a small ""x"" in 
chalk on a particular component of the machine and proudly stated, 
""This is where your problem is"".
The part was replaced and the machine worked perfectly again. The 
company received a bill for $50,000 from the engineer for his 
service.They demanded an itemized accounting of his charges. The 
engineer responded briefly:
One chalk mark                       $1 
Knowing where to put it            $49,999
It was paid in full and the engineer retired again in peace. 
"
48,"The graduate with a Science degree asks, ""Why does it work?""
The graduate with an Engineering degree asks, ""How does it work?""
The graduate with an Accounting degree Asks, ""How much will it cost?"" 
The graduate with a  Liberal Arts degree asks, ""Do you want fries 
with  that?""
"
49,"Three engineering students were gathered together discussing the
possible designers of the human body.  
One said, ""It was a mechanical engineer. Just look at all the joints.""  
Another said, ""No, it was an electrical engineer.  The nervous systems many thousands of electrical
connections.""  
The last said, ""Actually it was a civil engineer. Who else would run a toxic waste pipeline through a recreational area?""
"
50,"A guy goes into confession and says to the priest, ""Father, I'm 80 years
old, widower, with 11 grandchildren. Last night I met two beautiful flight
attendants. They took me home and I made love to both of them. Twice.""

The priest said: ""Well, my son, when was the last time you were in
confession?""
 ""Never Father, I'm Jewish.""
 ""So then, why are you telling me?""
 ""I'm telling everybody.""
"
51,"Did you hear that Clinton has announced there is a new national bird?  
The spread eagle.
"
52,"Q: What do Monica Lewinsky and Bob Dole have in common?
A: They were both upset when Bill finished first.
"
53,"One Sunday morning William burst into the living room and said,
""Dad! Mom! I have some great news for you! I am getting married
to the most beautiful girl in town. She lives a block away and
her name is Susan.""
After dinner, William's dad took him aside. ""Son, I have to talk
with you. Your mother and I have been married 30 years.. She's a
wonderful wife but she has never offered much excitement in the
bedroom, so I used to fool around with women a lot. Susan is
actually your half-sister, and I'm afraid you can't marry her.""
William was heart-broken. After eight months he eventually
started dating girls again. A year later he came home and very
proudly announced, ""Dianne said yes! We're getting married in
June.""
Again his father insisted on another private conversation and
broke the sad news. ""Dianne is your half-sister too, William. I'm
awfully sorry about this.""
William was furious! He finally decided to go to his mother with
the news.
""Dad has done so much harm.. I guess I'm never going to get
married,""  he complained. ""Every time I fall in love, Dad tells
me the girl is my half-sister.""
His mother just shook her head. ""Don't pay any attention to what
he says, dear. He's not really your father.""
"
54,"The Pope dies and, naturally, goes to heaven. He's met by the reception
committee, and after a whirlwind tour he is told that he can enjoy any
of the myriad of recreations available.
He decides that he wants to read all of the ancient original text of the
Holy Scriptures, so he spends the next eon or so learning languages.
After becoming a linguistic master, he sits down in the library and
begins to pour over every version of the Bible, working back from most
recent ""Easy Reading"" to the original script.
All of a sudden there is a scream in the library. The Angels come
running in only to find the Pope huddled in his chair, crying to himself
and muttering, ""An 'R'! The scribes left out the 'R'."" 
A particularly concerned Angel takes him aside, offering comfort, asks
him what the problem is and what does he mean. 
After collecting his
wits, the Pope sobs again, ""It's the letter 'R'. They left out the 'R'.
The word was supposed to be CELEBRATE!""
"
55,"A woman has twins, and gives them up for adoption.  One of
them goes to a family in Egypt and is named ""Amal.""  The other goes to
a  family in Spain; they name him ""Juan.""  Years later, Juan sends a
picture of himself to his mom.  Upon receiving the picture, she tells
her husband that she wishes she also had a picture of Amal.  
Her husband responds, ""But they are twins-if you've seen Juan, you've
seen   Amal.
"
56,"A man and Cindy Crawford get stranded on a desert island.  After a couple
of days they fall in love and start sleeping together.  Time pass the
man seems frustrated, Cindy asks if there is anything she can do?  He
says there is one thing, ""Could you put on this baseball cap and go to
the other side of the island and answer me when I call you Bob?""  She
agrees.  Next day he is walking on the other side of the island, runs
into her and says ""Hi Bob!""  
She says ""Hello, what's up?""  
He replies: ""Bob you won't believe it: I've been sleeping with Cindy
Crawford for the past two weeks!!!!""
"
57,"Why are there so many Jones's in the phone book?
Because they all have phones.
"
58,"How many teddybears does it take to change a lightbulb?

It takes only one teddybear, but it takes a whole lot of lightbulbs.
"
59,"The Chukcha (Russian Eskimo) phones up the Russian Parliament Building.  
A guard answers. 
Chukcha:  ""What is required to become Parliament member?""
Guard:  ""What are you, an idiot?""
Chukcha:  ""Is it required?""
"
60,"What did the Buddhist say to the hot dog vendor?
Make me one with everything.
"
61,"During a recent publicity outing, Hillary sneaked off to visit a
fortune teller of some local repute.  In a dark and hazy room, peering
into a crystal ball, the mystic delivered grave news.
""There's no easy way to say this, so I'll just be blunt: Prepare
yourself to be a widow.  Your husband will die a violent and horrible
death this year.""
Visibly shaken, Hillary stared at the woman's lined face, then at 
the single flickering candle, then down at her hands.  She took a few 
deep breaths to compose herself.  She simply had to know.  She met the
fortune teller's gaze, steadied her voice, and asked her question.
""Will I be acquitted?""
"
62,"A group of  managers were given the assignment to measure the
height of a flagpole. So they go out to the flagpole with ladders
and tape measures, and they're falling off the ladders, dropping
the tape measures - the whole thing is just a mess.
An engineer comes along and sees what they're trying to do,
walks over, pulls the flagpole out of the ground, lays it flat,
measures it from end to end, gives the measurement to one of the
managers and walks away.
After the engineer has gone, one manager turns to another and
laughs. ""Isn't that just like an engineer, we're looking for the 
height and he gives us the length.""
"
63,"An engineer, a physicist and a mathematician are sleeping in a
room. There is a fire in the room. The engineer wakes up, sees the fire,
picks up the bucket of water and douses the fire and goes back to
sleep. 

Again there is fire in the room. This time, the physicist wakes
up, notices the bucket, fills it with water, calculates the optimal
trajectory and douses the fire in minimum amount of water and goes
back to sleep. 

Again there is fire. This time the mathematician wakes up. 
He looks at the fire, looks at the bucket and the water and
exclaims, ""A solution exists"" and goes back to sleep.
"
64,"What is the rallying cry of the International Dyslexic Pride movement?
Dyslexics Untie!
"
65,"Two Rednecks were seated at the end of a bar when a young lady
seated a few stools up began to choke on a piece of hamburger.  She was
turning blue and obviously in serious respiratory distress.
One said to the other, ""That gal there is having a bad time!"" 
The other agreed and said ""Think we should go help?""  ""You bet,"" said the
first,and with that, he ran over and said, ""Can you breathe??""  She shook
her head no.  He said, ""Can you speak??""  She again shook her head no.
With that, he pulled up her skirt and licked her on the butt.
She was so shocked, she coughed up the obstruction and began to
breathe-with great relief.
The redneck walked back to his
friend and said, ""Funny how that hind lick maneuver always works.""
"
66,"A lawyer opened the door of his BMW, when suddenly a car came along
and hit the door, ripping it off completely.  When the police arrived
at the scene, the lawyer was complaining bitterly about the damage to
his precious BMW.  
""Officer, look what they've done to my Beeeeemer!!!"", he whined.  
""You lawyers are so materialistic, you make
me sick!!!""  retorted the officer.  ""You're so worried about your
stupid BMW, that you didn't even notice that your left arm was ripped
off!!!""  
""Oh my gaaaad..."", replied the lawyer, finally noticing the
bloody left shoulder where his arm once was.  ""Where's my
Rolex???!!!!""
"
67,"Once upon a time, two brooms fell in love and decided to get married.
Before the ceremony, the bride broom informed the groom broom that 
she was expecting a little whiskbroom. The groom broom was aghast!

""How is this possible?"" he asked. ""We've never swept together!
"
68,"A man piloting a hot air balloon discovers he has wandered off course and
is hopelessly lost. He descends to a lower altitude and locates a man
down on the ground. He lowers the balloon further and shouts ""Excuse me,
can you tell me where I am?""

The man below says: ""Yes, you're in a hot air balloon, about 30 feet
above this field.""

""You must work in Information Technology,"" says the balloonist.

""Yes I do,"" replies the man. ""And how did you know that?""

""Well,"" says the balloonist, ""what you told me is technically correct,
but of no use to anyone.""

The man below says, ""You must work in management.""

""I do,"" replies the balloonist, ""how did you know?""

""Well,"" says the man, ""you don't know where you are, or where you're
going, but you expect my immediate help. You're in the same position you
were before we met, but now it's my fault!""

"
69,"This guys wife asks, ""Honey if I died would you remarry?"" and he replies,
""Well, after a considerable period of grieving, we all need
companionship, I guess I would.""

She then asks, ""If I died and you remarried, would she live in this
house?"" and he replies, ""We've spent a lot of time and money getting this
house just the way we want it. I'm not going to get rid of my house, I
guess she would.""

""If I died and you remarried, and she lived in this house, would she
sleep in our bed?"" and he says, ""That bed is brand new, we just paid two
thousand dollars for it, it's going to last a long time, I guess she
would.""

So she asks, ""If I died and you remarried, and she lived in this house,
and slept in our bed, would she use my golf clubs?""

""Oh no, she's left handed.""
"
70,"Employer to applicant: ""In this job we need someone who is responsible.""

Applicant: ""I'm the one you want. On my last job, every time anything
went wrong, they said I was responsible.""

"
71,"At a recent Sacramento PC Users Group meeting,
a company was demonstrating its latest speech-
recognition software.   A representative from the
company was just about ready to start the
demonstration and asked everyone in the room
to quiet down.

Just then someone in the back of the room yelled,
""Format C: Return.""

Someone else chimed in:
""Yes, Return""

Unfortunately, the software worked.

"
72,"On the first day of college, the Dean addressed the students,
pointing out some of the rules:

""The female dormitory will be out-of-bounds for all male students
and the male dormitory to the female students. Anybody caught breaking
this rule will be finded $20 the first time."" He continued, ""Anybody 
caught breaking this rule the second time will be fined $60. Being caught
a third time will cost you a fine of $180. Are there any questions ?""

At this point, a male student in the crowd inquired:
""How much for a season pass ?""
"
73,"Q: What is the difference between George  Washington, Richard Nixon,
and Bill Clinton?

A: Washington couldn't tell a lie, Nixon couldn't   tell the truth, and
Clinton doesn't know the difference.
"
74,"Q: How many stalkers does it take to change a light bulb?

A: Two. One to replace the bulb, and the other to watch it day and night.
"
75,"Q: Do you know the difference between an intelligent male and the
Sasquatch?

A: There have been actual reported sightings of the Sasquatch.
"
76,"There once was a man and a woman that both  got in  a terrible car wreck. Both of their vehicles  
were completely destroyed, buy fortunately, no one  was   hurt.  In thankfulness, the woman said to the 
man, 'We are both okay, so we should celebrate. I have   a  bottle of wine in my car, let's open it.'         
So the woman got the bottleout of the car, and  handed it to the man. The man took a really big drink, 
and handed the woman the bottle. The  woman  closed the bottle and put it down. The man  asked,  
'Aren't you going to take a drink?' 

The woman cleverly replied, 
'No, I think I'll  just  wait for the cops to get here.'
"
77,"If pro- is the opposite of con- then congress must be the opposite
of progress.
"
78,"Q: What's the difference between the government  and  the Mafia?

A: One of them is organized.
"
