jokeId,jokeText
79,"Q: Ever wonder why the IRS calls it Form 1040?

A: Because for every $50 that you earn, you get 10 and they get 40.
"
80,"Hillary, Bill Clinton and the Pope are sitting together on an airplane.

Bill says ""I could throw one thousand dollar bill out of this plane and
make one person very happy.""

Hillary says ""I could throw 10 hundred dollar bills out of the plane and
make 10 people very happy.""

The Pope chips in and says ""I could throw Bill out of the airplane and make the whole 
country happy.""
"
81,"An Asian man goes into a New York CityBank to exchange 10,000 yen for
American Currency.  The teller gives him $72.00.  The next month the
Asian man goes into the same bank with 10,000 yen and receives $62.00.
He asks, ""How come? Only $62.00?"" The teller says ""Fluctuations-
Fluctuations!""

Whereupon the Asian man looks back at the teller and says ""Fluk you
Amelicans too!""
"
82,"Q: How do you keep a computer programmer in the 
shower all day long?

A: Give them a shampoo with a label that says
""rinse, lather, repeat"".
"
83,"What a woman says:

""This place is a mess!  C'mon,
You and I need to clean up,
Your stuff is lying on the floor and
you'll have no clothes to wear,
if we don't do laundry right now!""

What a man hears:

blah, blah, blah, blah, C'mon
blah, blah, blah, blah, you and I
blah, blah, blah, blah, on the floor
blah, blah, blah, blah, no clothes
blah, blah, blah, blah, RIGHT NOW!
"
84,"Q: What is the difference between Mechanical Engineers and Civil 
Engineers?
 
A: Mechanical Engineers build weapons, Civil Engineers build targets.
"
85,"Q: How many Presidents does it take to screw in a light bulb?

A: It depends upon your definition of screwing a light bulb.
"
86,"A neutron walks into a bar and orders a drink.
""How much do I owe you?"" the neutron asks.

The bartender replies, ""for you, no charge.""
"
87,"A man, recently completing a routine physical examination receives a
phone call from his doctor.  The doctor says, ""I have some good news and
some bad news.""  The man says, ""OK, give me the good news first.""  The
doctor says, ""The good news is, you have 24 hours to live.""  The man
replies, ""Shit!  That's the good news?  Then what's the bad news?""

The doctor says, ""The bad news is, I forgot to call you yesterday.""
"
88,"A Czechoslovakian man felt his eyesight was growing steadily worse, and 
felt it was time to go see an optometrist. 

The doctor started with some simple testing, and showed him a standard eye 
chart with letters of
diminishing size: CRKBNWXSKZY. . . 

""Can you read this?"" the doctor asked. 

""Read it?"" the Czech answered. ""Doc, I know him!""
"
89,"A radio conversation of a US naval 
ship with Canadian authorities ... 

Americans: Please divert your course 15 degrees to the North to avoid a
collision.

Canadians: Recommend you divert YOUR course 15 degrees to the South to 
avoid a collision.

Americans: This is the Captain of a US Navy ship.  I say again, divert 
YOUR course.

Canadians: No.  I say again, you divert YOUR course.

Americans: This is the aircraft carrier USS LINCOLN, the second largest ship in the United States' Atlantic Fleet. We are accompanied by three destroyers, three cruisers and numerous support vessels. I demand that you change your course 15 degrees north, that's ONE FIVE DEGREES NORTH, or counter-measures will be undertaken to ensure the safety of this ship.

Canadians: This is a lighthouse.  Your call.
"
90,"Q: How many programmers does it take to change a lightbulb?

A: NONE!   That's a hardware problem....
"
91,"A Panda bear walks into a bar.  Sits down at a table and orders a beer 
and a double cheeseburger.  After he is finished eating, he pulls out a gun
and rips the place with gunfire.  Patrons scatter and dive under chairs and
tables as the bear runs out the door.  After ensuring that no one is hurt, 
the bartender races out the door, and calls after the bear ""What the hell did
you do that for?""  The bear calls back, ""I'm a Panda bear.  Look it up in the
dictionary.""  

The bartender returns, pulls out his dictionary.

panda : \Pan""da\, n. (Zo[""o]l.)
A small Asiatic mammal (Ailurus fulgens) having fine soft fur.
It is related to the bears, and inhabits the mountains of Northern India.
Eats shoots and leaves.
"
92,"Early one morning a mother went to her sleeping son and woke him up.

""Wake up, son.  It's time to go to school."" 
""But why, Mama?  I don't want to go to school."" 
""Give me two reasons why you don't want to go to school."" 
""One, all the children hate me. Two, all the teachers hate me,"" 
""Oh! that's no reason. Come on, you have to go to school,"" 

""Give me two good reasons WHY I should go to school?"" 
 
""One, you are fifty-two years old. Two, you are the principal of the
 school.""
 "
93,"Reaching the end of a job interview, the human resources person asked a
young engineer fresh out of Stanford,

""And what starting salary were you looking for?""

The engineer said, ""In the neighborhood of $125,000 a year, depending
on the benefits package.""

The interviewer said, ""Well, what would you say to a package of 5-weeks 
vacation, 14 paid holidays, full medical and dental, company matching 
retirement fund to 50% of salary, and a company car leased every 2 years - 
say, a red Corvette?""

The Engineer sat up straight and said, ""Wow! Are you kidding?""

And the interviewer replied, ""Yeah, but you started it.""
"
94,"Two atoms are walking down the street when one 
atom says to the other 
""Oh, my! I've lost an electron!""

The second atom says""Are you sure""

The first replies ""I'm positive!""
"
95,"Just a thought ..

Before criticizing someone, walk a mile in their shoes.  

Then when you do criticize them, 
you will be a mile away and have their shoes !
"
96,"Two attorneys went into a diner and ordered two drinks.  Then they produced 
sandwiches from their briefcases and started to eat.  The owner became
quite concerned and marched over and told them, ""You can't eat your own
sandwiches in here!""

The attorneys looked at each other, shrugged their shoulders and then
exchanged sandwiches.
"
97,"A teacher is explaining to her class how different languages use 
negatives differently.  She says, ""In all languages, a positive followed
by a negative or a negative followed by a positive makes a negative.  In
some languages, two negatives together make a positive, while in others they
make a negative.  But in no language do two positives make a negative.""  

One of the students puts up his hand and says, ""Yeah, right.""
"
98,"Age and Womanhood

1. Between the ages of 13 and 18 ...
She is like Africa, virgin and unexplored. 

2. Between the ages of 19 and 35 ...
She is like Asia, hot and exotic. 

3. Between the ages of 36 and 45 ...
She is like America, fully explored, breathtakingly beautiful,and free with her resources.

4. Between the ages of 46 and 56 ...
She is like Europe, exhausted but still has points of interest. 

5. After 56 she is like Australia ...
Everybody knows it's down there, but who gives a damn?
"
99,"A bus station is where a bus stops.
A train station is where a train stops.

On my desk I have a work station...
"
100,"Q: Whats the difference between greeting a Queen and greeting the
President of the United  States?

A: You only have to get on one knee to greet the queen.
"
101,Did you hear about the Buddhist who refused Novocaine during a root canal? He wanted to transcend dental medication.
102,"A man escaped jail by digging a hole from his jail cell to the outside world. When finally his work was done, he emerged in the middle of a preschool playground. ""I'm free, I'm free!"" he shouted. ""So what?"" said a little girl. ""I'm four."""
103,"Nurse: Doctor, Doctor, there's an invisible man in the waiting room! Doctor: Well, go in there and tell him that I can't see him!"
104,"As a pre-med student, I had to take a difficult class in physics. One day our professor was discussing a particularly complicated concept. A student rudely interrupted to ask, ""Why do we have to learn this stuff?"" ""To save lives."" The professor responded quickly and continued the lecture. A few minutes later, the same student spoke up again. ""So how does physics save lives?"" he persisted. ""It usually keeps the idiots like you out of medical school,"" replied the professor."
105,"A couple of hunters are out in the woods in the deep south when one of them falls to the ground. He doesn't seem to be breathing, and his eyes are rolled back in his head. The other guy whips out his cell phone and calls 911. He gasps to the operator, ""My friend is dead! What can I do?"" The operator, in a calm and soothing voice, says, ""Alright, take it easy. I can help. First, let's make sure he's dead."" There is silence, and then a gun shot is heard. The hunter comes back on the line. ""Okay. Now what??"""
106,"An engineer dies and reports to the pearly gates. St. Peter checks his dossier and says, ""Ah, you''re an engineer--you're in the wrong place."" So, the engineer reports to the gates of hell and is let in. Pretty soon, the engineer gets dissatisfied with the level of comfort in hell, and starts designing and building improvements. After awhile, they've got air conditioning, flush toilets and escalators, and the engineer is a pretty popular guy. One day, God calls Satan up on the telephone and says with a sneer, ""So, how's it going down there in hell?"" Satan replies, ""Hey, things are going great. We've got air conditioning, flush toilets and escalators, and there's no telling what this engineer is going to come up with next."" God replies, ""What?? You've got an engineer? That's a mistake--he should never have gotten down there; send him up here."" Satan says, ""No way."" I like having an engineer on the staff, and I'm keeping him."" God says, ""Send him back up here or I'll sue."" Satan laughs uproariously and answers, ""Yeah, right. And just where are YOU going to get a lawyer?"""
107,"(A) The Japanese eat very little fat and suffer fewer heart attacks than the British or Americans. (B) On the other hand, the French eat a lot of fat and also suffer fewer heart attacks than the British or Americans. (C) The Chinese drink very little red wine and suffer fewer heart attacks than the British or Americans. (D) The Italians drink excessive amounts of red wine and also suffer fewer heart attacks than the British or Americans. (E) Conclusion: Eat and drink what you like. It's speaking English that kills you."
108,"A man approached a very beautiful woman in a large supermarket and asked, ""You know, I've lost my wife here in the supermarket. Can you talk to me for a couple of minutes?"" ""Why?"" ""Because every time I talk to a beautiful woman my wife appears out of nowhere."""
109,"Do you believe in life after death? the boss asked one of his employees. ""Yes, sir,"" the new recruit replied. ""Well, then, that makes everything just fine..."" the boss went on. ""After you left early yesterday to go to your grandmother's funeral, she stopped in to see you."""
110,"One day, a professor was giving a big test to his students. He handed out the tests and went back to his desk to wait. Once the test was over, the students all handed the tests back in. The professor noticed that one of the students had attached a $100 bill to his test with a note saying: ""A dollar per point."" The next class the professor handed the tests back out. This student got back his test...and $64 change!"
111,"A new business was opening and one of the owner's friends wanted to send him flowers for the occasion. They arrived at the new business site and the owner read the card, ""Rest in Peace."" The owner was angry and called the florist to complain. After he had told the florist of the obvious mistake and how angry he was, the florist replied, ""Sir, I'm really sorry for the mistake, but rather than getting angry, you should imagine this: somewhere there is a funeral taking place today, and they have flowers with a note saying, 'Congratulations on your new location!'"""
112,"When my three-year-old son opened the birthday gift from his grandmother, he discovered a water pistol. He squealed with delight and headed for the nearest sink. I was not so pleased. I turned to Mom and said, ""I'm surprised at you. Don't you remember how we used to drive you crazy with water guns?"" Mom smiled and then replied...""I remember."""
113,"The new employee stood before the paper shredder looking confused. ""Need some help?"" a secretary asked. ""Yes,"" he replied. ""How does this thing work?"" ""Simple,"" she said, taking the fat report from his hand and feeding it into the shredder. ""Thanks, but where do the copies come out?"""
114,"Sherlock Holmes and Dr. Watson go on a camping trip, set up their tent, and fall asleep. Some hours later, Holmes wakes his faithful friend. ""Watson, look up at the sky and tell me what you see."" Watson replies, ""I see millions of stars."" ""What does that tell you?"" Watson ponders for a minute. ""Astronomically speaking, it tells me that there are millions of galaxies and potentially billions of planets. Astrologically, it tells me that Saturn is in Leo. Timewise, it appears to be approximately a quarter past three. Theologically, it's evident the Lord is all-powerful and we are small and insignificant. Meteorologically, it seems we will have a beautiful day tomorrow. What does it tell you?"" Holmes is silent for a moment, then speaks. ""Watson, you idiot, someone has stolen our tent."""
115,"A lady bought a new Lexus. It cost a bundle. Two days later, she brought it back, complaining that the radio was not working. ""Madam,"" said the sales manager, ""the audio system in this car is completely automatic. All you need to do is tell it what you want to listen to, and you will hear exactly that!"" She drove out, somewhat amazed and a little confused. She looked at the radio and said, ""Nelson."" The radio responded, ""Ricky or Willie?"" She was astounded. If she wanted Beethoven, that's what she got. If she wanted Nat King Cole, she got it. She was stopped at a traffic light enjoying ""On the Road Again"" when the light turned green and she pulled out. Suddenly an enormous sports utility vehicle coming from the street she was crossing sped toward her, obviously not paying attention to the light. She swerved and narrowly missed a collision. ""Idiot!"" she yelled and, from the radio, ""Ladies and gentlemen, the President of the United States."""
116,"A man in a hot air balloon realized he was lost. He reduced altitude and spotted a woman below. He descended a bit more and shouted, ""Excuse me, can you help me? I promised a friend I would meet him an hour ago, but I don't know where I am."" The woman below replied, ""You are in a hot air balloon hovering approximately 30 feet above the ground. You are between 40 and 41 degrees north latitude and between 59 and 60 degrees west longitude."" ""You must be an engineer,"" said the balloonist. ""I am,"" replied the woman. ""How did you know?"" ""Well,"" answered the balloonist, ""everything you told me is technically correct, but I have no idea what to make of your information, and the fact is, I am still lost. Frankly, you've not been much help so far."" The woman below responded, ""You must be in management."" ""I am,"" replied the balloonist, ""but how did you know?"" ""Well,"" said the woman, ""you don't know where you are or where you are going. You have risen to where you are due to a large quantity of hot air. You made a promise that you have no idea how to keep, and you expect people beneath you to solve your problems. The fact is, you are in exactly the same position you were in before we met, but now, somehow, it's my fault!"""
117,"A man joins a big corporate empire as a trainee. On his very first day of work, he dials the pantry and shouts into the phone: ""Get me a coffee, quickly!"" The voice from the other side responds, ""You fool, you've dialed the wrong extension! Do you know who you're talking to, dumbo?"" ""No,"" replied the trainee. ""It's the CEO of the company, you fool!"" The trainee shouts back, ""And do YOU know who YOU are talking to, you fool?!"" ""No."" replied the CEO indignantly. ""Good!"" replied the trainee, and puts down the phone."
118,"A man goes into a drug store and asks the pharmacist if he can give him something for the hiccups. The pharmacist promptly reaches out and slaps the man's face. ""What the heck did you do that for?!"" the man screams. ""Well, you don't have the hiccups anymore, do you?"" The man says, ""No I don't, you IDIOT...but my wife out in the car still does!"""
119,"One day the first grade teacher was reading the story of the Three Little Pigs to her class. She came to the part of the story where the first pig was trying to accumulate the building materials for his home. She read, ""...and so the pig went up to the man with the wheelbarrow full of straw and said, 'Pardon me sir, but may I have some of that straw to build my house?'"" The teacher paused then asked the class, ""And what do you think that man said?"" One little boy raised his hand and said, ""I know...he said, 'Holy Shit! A talking pig!'"""
120,"Judy was having trouble with her computer, so she called Tony, the computer guy, over to her desk. Tony clicked a couple buttons and solved the problem. As he was walking away, Judy called after him, ""So, what was wrong?"" And he replied, ""It was an ID Ten T Error."" A puzzled expression ran riot over Judy's face. ""An ID Ten T Error? What's that...in case I need to fix it again?"" He gave her a grin...""Haven't you ever heard of an ID Ten T Error before?"" ""No,"" replied Judy. ""Write it down,"" he said, ""and I think you'll figure it out."" (She wrote...) I D 1 0 T"
121,"A drunk staggers into a Catholic Church, enters a confessional booth, sits down, but says nothing. The Priest coughs a few times to get his attention but the drunk just sits there. Finally, the Priest pounds three times on the wall. The drunk mumbles, ""Ain't no use knockin, there's no paper on this side either."""
122,"An astronomer, a physicist and a mathematician (it is said) were holidaying in Scotland. Glancing from a train window, they observed a black sheep in the middle of a field. ""How interesting,"" observed the astronomer, ""All Scottish sheep are black!"" To which the physicist responded, ""No, no! Some Scottish sheep are black!"" The mathematician gazed heavenward in supplication, and then intoned, ""In Scotland there exists at least one field, containing at least one sheep, at least one side of which is black."""
123,"When most people claim to be ""killing time"", it's only an expression. When Chuck Norris kills time, the minutes actually cease to exist."
124,"Person 1: Hey, wanna hear a great knock-knock joke? Person 2: Sure, What is it? Person 1: Okay, you start. Person 2: Knock-knock. Person 1: Who's there? Person 2: ... Person 1: Hah!"
125,"An American tourist goes into a restaurant in Spain and orders the specialty of the house. When his dinner arrives, he asks the waiter what it is. ""These, senor,"" replied the waiter in broken English, ""are the testicles of the bull killed in the ring today."" The tourist swallowed hard but tasted the dish and thought it was delicious. So he comes back the next evening and orders the same item. When it is served, he says to the waiter, ""These testicles...are much smaller than the ones I had last night."" ""Yes, senor,"" replied the waiter, ""You see...the bull, he does not always lose."
126,"A Briton, a Frenchman and a Russian are viewing a painting of Adam and Eve frolicking in the Garden of Eden. ""Look at their reserve, their calm,"" muses the Brit. ""They must be British."" ""Nonsense,"" the Frenchman disagrees. ""They're naked, and so beautiful. Clearly, they are French."" ""No way! They have no clothes and no shelter,"" the Russian points out, ""They have only an apple to eat, and they are being told they live in a paradise. Obviously, they are Russian."""
127,"A little boy goes to his dad and asks, ""What is politics?"" His dad says, ""Well son, let me try to explain it this way: I'm the breadwinner of the family, so let's call me capitalism. Your Mom, she's the administrator of the money, so we'll call her the government. We're here to take care of your needs, so we'll call you the people. The nanny, we'll consider her the working class. And your baby brother, we'll call him the future. Now, think about that and see if that makes sense."" So the little boy goes off to bed thinking about what dad had said. Later that night, he hears his baby brother crying, so he gets up to check on him. He finds that the baby has severely soiled his diaper. So the little boy goes to his parents' room and finds his mother sound asleep. Not wanting to wake her, he goes to the nanny's room. Finding the door locked, he peeks in the keyhole and sees his father in bed with the nanny. He gives up and goes back to bed. The next morning, the little boy says to his father, ""Dad, I think I understand the concept of politics now."" The father says, ""Good, son. Tell me in your own words what you think politics is all about."" The little boy replies, ""Well, while capitalism is screwing the working class, the government is sound asleep, the people are being ignored and the future is in deep shit."""
128,"An American, a Scot and a Canadian were in a terrible car accident. They were all brought to the same emergency room, but all three of them died before they arrived. Just as they were about to put the toe tag on the American, he stirred and opened his eyes. Astonished, the doctors and nurses present asked him what happened. ""Well,"" said the American, ""I remember the crash, and then there was a beautiful light, and then the Canadian and the Scot and I were standing at the gate s of heaven. St. Peter approached us and said that we were all to young to die, and that for a donation of $50, we could return to earth. So of course I pulled out my wallet and gave him the $50, and the next thing I knew I was back here."" ""That's amazing!"" said the one of the doctors, ""But what happened to the other two?"" ""Last I saw them,"" replied the American, ""the Scot was haggling over the price and the Canadian was waiting for the government to pay his."""
129,"A group of girlfriends is on vacation when they see a 5-story hotel with a sign that reads: ""For Women Only."" Since they are without their boyfriends and husbands, they decide to go in. The bouncer, a very attractive guy, explains to them how it works. ""We have 5 floors. Go up floor by floor, and once you find what you are looking for, you can stay there. It's easy to decide since each floor has a sign telling you what's inside."" So they start going up and on the first floor the sign reads: ""All the men on this floor are short and plain."" The friends laugh and without hesitation move on to the next floor. The sign on the second floor reads: ""All the men here are short and handsome."" Still, this isn't good enough, so the friends continue on up. They reach the third floor and the sign reads: ""All the men here are tall and plain."" They still want to do better, and so, knowing there are still two floors left, they continued on up. On the fourth floor, the sign is perfect: ""All the men here are tall and handsome."" The women get all excited and are going in when they realize that there is still one floor left. Wondering what they are missing, they head on up to the fifth floor. There they find a sign that reads: ""There are no men here. This floor was built only to prove that there is no way to please a woman."""
130,"An old man goes to the doctor for his yearly physical, his wife tagging along. When the doctor enters the examination room, he tells the old man, ""I need a urine sample, a stool sample and a sperm sample."" The old man, being hard of hearing, looks at his wife and yells: ""WHAT? What did he say? What's he want?"" His wife yells back, ""He needs your underwear."""
131,"A guy had been feeling down for so long that he finally decided to seek the aid of a psychiatrist. He went there, lay on the couch, spilled his guts then waited for the profound wisdom of the psychiatrist to make him feel better. The psychiatrist asked me a few questions, took some notes then sat thinking in silence for a few minutes with a puzzled look on his face. He looked up with an expression of delight and said, ""I think your problem is low self-esteem. It is very common among losers."""
132,"Mickey Mouse is having a nasty divorce with Minnie Mouse. Mickey spoke to the judge about the separation. ""I'm sorry Mickey, but I can't legally separate you two on the grounds that Minnie is mentally insane..."" Mickey replied, ""I didn't say she was mentally insane, I said that she's fucking Goofy!"""
133,"The new employee stood before the paper shredder looking confused. ""Need some help?"" a secretary, walking by, asked. ""Yes,"" he replied, ""how does this thing work?"" ""Simple,"" she said, taking the fat report from his hand and feeding it into the shredder. ""Thanks, but where do the copies come out?"""
134,"An artist asked the gallery owner if there had been any interest in his paintings currently on display. ""I've got good news and bad news,"" the owner replied. ""The good news is that a gentleman inquired about your work and wondered if it would appreciate in value after your death. When I told him it would, he bought all fifteen of your paintings."" ""That's wonderful!"" the artist exclaimed. ""What's the bad news?"" With concern, the gallery owner replied:""The guy was your doctor."""
