jokeId,jokeText
135,"A guy walked past a mental hospital and heard a moaning voice: ""13...13...13...13..."" The man looked over to the hospital and saw a hole in the wall. He looked through the hole and got poked in the eye. The moaning voice then groaned: ""14...14...14...14..."""
136,"A man went to apply for a job. After filling out all of his applications, he waited anxiously for the outcome. The employer read all his applications and said, ""We have an opening for people like you."" ""Oh, great,"" he said. ""What is it?"" ""It's called the door!"""
137,"Deep within a forest, a little turtle began to climb a tree. After hours of effort, he reached the top, jumped into the air waving his front legs and crashed to the ground. After recovering, he slowly climbed the tree again, jumped, and fell to the ground. The turtle tried again and again, while a couple of birds sitting on a branch watched his sad efforts. Finally, the female bird turned to her mate. ""Dear,"" she chirped, ""I think it's time to tell him he's adopted."""
138,"WASHINGTON (Reuters) - A tragic fire on Monday destroyed the personal library of President George W. Bush. Both of his books have been lost. Presidential spokesman Ari Fleischer said the president was devastated, as he had not finished coloring the second one."
139,"In a Veteran's Day speech, President Bush vowed, ""We will finish the mission. Period."" Afterwards, he was advised that he doesn't have to read the punctuation marks."
140,Chuck Norris' calendar goes straight from March 31st to April 2nd; no one fools Chuck Norris.
141,Jack Bauer can get McDonald's breakfast after 10:30.
142,"One day, three men went to a shrine to ask the Father for forgiveness. The first man went to the Father... First Man: ""Father, Father, I have sinned!"" Father: ""What have you done?"" First Man: ""I have lied!"" Father: ""Drink the holy water and you will be saved."" And so the man drank the water and was ""saved."" The second man went up to the Father... Second Man: ""Father, Father, I have sinned!"" Father: ""What have you done?"" Second Man: ""I have stolen from the jeweler's!"" Father: ""Drink the holy water and you will be saved."" And so the second man drank the holy water and was ""saved."" The third man went up to the Father... Third Man: ""Father, Father, I have sinned!"" Father: ""What have you done?"" Third Man: ""I peed in the holy water!"""
143,"A preist, a 12-year-old kid, and the smartest guy in the world are on a plane. The pilot screams, ""The plane is going down! You have to jump!"" He then grabs a parachute and jumps off, leaving only two more parachutes on the plane. The smartest guy in the world says, ""I have to go. I mean, I'm the smartest guy in the world!"" He grabs a parachute, and jumps. The priest then looks at the 12-year-old kid, and says, ""Go, my son. You have a long life to live."" The kid calmly responds: ""Dude, chill. We'll be fine. The 'smartest guy in the world' took my backpack."""
144,"A man is driving in the country one evening when his car stalls and won't start. He goes up to a nearby farm house for help, and because it is suppertime he is asked to stay for supper. When he sits down at the table he notices that a pig is sitting at the table with them for supper and that the pig has a wooden leg. As they are eating and chatting, he eventually asks the farmer why the pig is there and why it has a wooden leg. ""Oh,"" says the farmer, ""that is a very special pig. Last month my wife and daughter were in the barn when it caught fire. The pig saw this, ran to the barn, tipped over a pail of water, crawled over the wet floor to reach them and pulled them out of the barn safely. A special pig like that, you just don't eat it all at once!"""
145,"A blonde, brunette, and a red head are all lined up to be shot to death by a firing squad. The brunette shouts, ""Tornado!"" and the riflemen turn around to see the tornado. It isn't there, and the brunette uses that time to escape. The red head yells, ""Lightning!"" and the riflemen again turn to see the disaster, yet there is no disaster and the red head escapes. The blonde yells, ""Fire!"" The riflemen do."
146,America: 8:00 - Welcome to work! 12:00 - Lunch break 17:00 - The work day is over Japan: 8:00 - Are you already at work? 12:00 - Continue your work 17:00 - The work day is over 20:00 - Please finish your work Romania: 8:00 - Has anyone come to work? 12:00 - Did someone start working? 16:00 - Is anyone at work?
147,"It was the day of the big sale. Rumors of the sale (and some advertising in the local paper) were the main reason for the long line that formed by 8:30, the store's opening time, in front of the store. A small man pushed his way to the front of the line, only to be pushed back, amid loud and colorful curses. On the man's second attempt, he was punched square in the jaw, and knocked around a bit, and then thrown to the end of the line again. As he got up the second time, he said to the person at the end of the line... ""That does it! If they hit me one more time, I won't open the store!"""
148,"Recently a teacher, a garbage collector, and a lawyer wound up together at the Pearly Gates. St. Peter informed them that in order to get into Heaven, they would each have to answer one question. St. Peter addressed the teacher and asked, ""What was the name of the ship that crashed into the iceberg? They just made a movie about it."" The teacher answered quickly, ""That would be the Titanic."" St. Peter let him through the gate. St. Peter turned to the garbage man and, figuring Heaven didn't really need all the odors that this guy would bring with him, decided to make the question a little harder: ""How many people died on the ship?"" Fortunately for him, the trash man had just seen the movie. ""1,228,"" he answered. ""That's right! You may enter."" St. Peter turned to the lawyer: ""Name them."""
149,"A little girl asked her father, ""Daddy? Do all fairy tales begin with 'Once Upon a Time'?"" He replied, ""No, there is a whole series of fairy tales that begin with 'If elected I promise'."""
150,"In an interview with David Letterman, Carter passed along an anecdote of a translation problem in Japan. Carter was speaking at a business lunch in Tokyo, where he decided to open his speech with a brief joke. He told the joke, then waited for the translator to announce the Japanese version. Even though the story was quite short, Carter was surprised by how quickly the interpreter was able to re-tell it. Even more impressive was the reaction from the crowd. Carter thought the story was cute, but not outright hilarious, yet the crowd broke right up. Carter was very flattered. After the speech, Carter wanted to meet the translator to ask him how he told the joke. Perhaps there is better way to tell the joke? When Carter asked how the joke had been told in Japanese, the translator responded, 'I told them, 'President Carter has told a very funny joke. Please laugh now.''"
